,Link,clean_text
349,https://www.channelnewsasia.com/singapore/1-billion-money-laundering-su-haijin-12-new-charges-4234086,A man jumped balcony raid arrest suspects linked billiondollar money laundering probe received 12 new charges Monday Apr 1 This brings total number charges Su Haijin faces 14 total amount suspected criminal proceeds allegedly held S38 million US28 million Cypriot national Su 41 initially set plead guilty week Thursday Both prosecution defence confirmed plea go ahead planned He initially faced charges resisting arrest Aug 15 2023 possessing S406 million benefits illegal remote gambling offences UOB account around August 2023
350,https://www.channelnewsasia.com/asia/fascinated-bak-kut-teh-japanese-man-brings-singapore-dish-tokyo-1012186,Fascinated impactful obsessed words Akihiro Takahashi used describe first experience eating bak kut teh That happened three ago 43yearold business trip He visited Founder Bak Kut Teh love first bite I fascinated delicious taste impactful lowprofile Japanese declined photographed interview At start bak kut teh looks like simple dish mouthful taste pepper garlic juiciness pork meat
351,https://www.channelnewsasia.com/sport/pistorius-paroled-decade-after-killing-girlfriend-3943966,South African former Paralympic star Oscar Pistorius granted early release prison Friday Nov 24 decade fatally shot girlfriend Reeva Steenkamp crime gripped world prison authorities A parole board reviewing whether Pistorius 37 fit social reintegration decided place parole Jan 5 2024 Department Correctional Services Pistorius complete remainder sentence system community corrections subjected supervision compliance parole conditions sentence expires
352,https://www.channelnewsasia.com/singapore/job-heartland-waste-collector-rancid-repulsive-and-sobering-experience-988706,dont know worse smell creepy crawlies stench rotting food like vomit mixed dank dirty laundry struggled retch Then bugs scuttled everywhere bent pick trash Such working conditions norm Zuwel Bangladeshi worker clears trash 29 blocks Bukit Panjang every day stepped shoes couple days last month labouring sweltering heat dashing rubbish chute another electric cart empty bins According 2012 World Bank report person generates 149kg municipal waste every day This figure par Malaysia higher Indonesia Philippines South Korea expected grow 18kg 2025
353,https://www.channelnewsasia.com/watch/refugee-chef/afghan-last-1555781,For 28 Javad Ghaderi kept Afghan nationality secret He asylum seeker endured deportation 3 times It food helped critical junctions using Persian cuisine solidify new friendships locals Wollongong Australia About show Over past issue refugees become highly politicised Refugees seen either victims aggressors kept Yet groups refugees trumped odds In series feature earlier wave refugees havent survived thriving today giving back communities Our culinary heroes originated every part Asia fanned across globe search new lives Today using food powerful ways reshaping way people see Asia Behind dish story survival stories refugees seek freedom societies conflict people struggle build new lives treasured family recipes cities enriched presence This series proves food truly break walls help us find commonality across different people
354,https://www.channelnewsasia.com/sport/south-korean-footballer-song-ui-yong-wants-to-play-for-singapore-905641,When first arrived freshfaced teenager little seven ago sum Song Uiyoungs English vocabulary totalled words I couldnt speak English knew yes South Korean footballer But 18yearold Yeouido High School student nonetheless determined least talking pitch My coach Korea knew Home United coach Lee Lim Saeng recommended Then coach Lee came watch game liked Song After talked asked play reserve Prime League first thought could adjust maybe could step chance play SLeague Premier League
355,https://www.channelnewsasia.com/sport/chinas-divers-delight-abdullah-sets-weightlifting-world-record-3818351,Indonesias Rahmat Erwin Abdullah set weightlifting world record Chinas worldbeating teenage divers wowed fans soccer players crashed day 10 Hangzhou Asian Games Tuesday Oct 3 Abdullah secured gold lift 201kg mens 73kg clean jerk beat previous record 200kg set last December 22yearolds lift follows three world records set North Korean weightlifters Games pretty good performance still maximum Abdullah always empty mind every time lift wanted focus clean jerk nothing else
356,https://www.channelnewsasia.com/sport/former-champion-venus-williams-suffers-early-us-open-exit-3733891,Twotime US Open champion Venus Williams suffered lopsided loss 24 appearances Grand Slam tournament 61 61 defeat hands qualifier Greet Minnen first round Tuesday Belgian smacked 24 winners saved six break points faced dispatch veteran American reveres In 1997 Venus already played final born incredible play legend like 26yearold Minnen oncourt interview huge respect Former world number Williams best chance climbing back contest came break point opportunity opening game second set failed convert
357,https://www.channelnewsasia.com/sport/keeper-peretz-arrival-investment-future-says-bayern-ceo-3729521,arrival Israeli keeper Daniel Peretz Bayern Munich investment future merely stopgap signing Manuel Neuer returns full fitness club CEO JanChristian Dreesen Monday Aug 28 Bayern signed Peretz Maccabi Tel Aviv fiveyear deal Friday 23yearold becoming first Israeli player sign club Neuer 37 remains sidelined breaking leg skiing December Germany international started individual training return action still looks weeks away With goalkeepers Yann Sommer Alexander Nuebel leaving summer Bayern turn 35yearold Sven Ulreich first league matches season victories
358,https://www.channelnewsasia.com/sport/russian-criticism-athletes-parade-ban-was-very-aggressive-ioc-4209651,Political commentators Russia noted Bachs German nationality made references Holocaust social media posts We seen aggressive statements Russia today One comment goes beyond Adams Linking president nationality Holocaust unacceptable reaches new low Relations Russia IOC deteriorated sharply Russians Belarusians compete neutral athletes Paris IOC suspended Russian Olympic Committee October recognising regional Olympic councils Russianoccupied regions Ukraine Luhansk Donetsk Kherson Zaporizhzhia Russia hosted 2014 Winter Olympics Sochi planning organise multinational Friendship Games September angering IOC
359,https://www.channelnewsasia.com/singapore/money-laundering-suspects-police-probe-raids-gcb-condo-prime-areas-seized-3703491,Su Haijin 40yearold Cyprus national arrested GCB along Ewart Park Holland area Charged count resisting lawful apprehension Vang Shuiming 42yearold Turkiye national arrested GCB along Bishopsgate Tanglin area Charged count using forged document Zhang Ruijin 44yearold China national Lin Baoying 43yearold China national arrested bungalow along Pearl Island Sentosa Cove Both charged count forgery purpose cheating Su Baolin 41yearold Cambodia national arrested GCB along Nassim Road Charged count using forged document Su Jianfeng 35yearold NiVanuatu national arrested GCB along Third Avenue near Bukit Timah Charged count money laundering Chen Qingyuan 33yearold Cambodia national arrested condominium along Leonie Hill Road River Valley area Charged count money laundering
360,https://www.channelnewsasia.com/sport/two-years-after-olympic-defection-belarusian-sprinter-cleared-race-poland-3683076,Krystsina Tsimanouskaya Belarusian sprinter defected Tokyo Olympics ago cleared World Athletics compete Poland waived normal threeyear waiting period nationality changes Tsimanouskaya refused board flight back home Tokyo removed Olympics publicly complaining national team coaches decision enter 4x400 metres relay customary distance She defected Poland saying feared safety returned Belarus Poland granted citizenship last year A letter World Athletics Nationality Review Panel seen Reuters Monday Tsimanouskaya could represent Poland starting Aug 6 2023
361,https://www.channelnewsasia.com/asia/russians-thailand-phuket-ukraine-easy-visa-entry-3661541,Russian businessman Alexander Nakhapetov regular banyas adopted home Phuket ever since several traditional steam baths opened last year Lately though 41yearolds routine disrupted influx countrymen Thailands biggest island  resulted new bathhouses booked much time While Phuket long attracted Russias wealthier citizens influx accelerating Vladimir Putins war Ukraine makes competing destinations Europe elsewhere harder enter number villas sold island last year surged 82 per cent 338 half purchased Russians according real estate agency Knight Frank Thailand Enterprises restaurants saunas concerts sprung appealing new clientele
362,https://www.channelnewsasia.com/sport/nba-basketball-kyle-anderson-chinese-citizenship-3649811,Minnesota Timberwolves forward Kyle Anderson obtained Chinese citizenship naturalisation Chinese Basketball Association CBA Monday Jul 24 29yearold forward New York latest elite athlete gain Chinese nationality naturalisation first basketball player Anderson obtained Chinese nationality morning met Yao Ming chairman Chinese Basketball Association CBA post official Weibo account Citizenship could potentially allow Anderson play China FIBA World Cup tips Aug 25 Philippines Japan Indonesia well Olympic Games Paris next year
363,https://www.channelnewsasia.com/sport/uruguay-striker-leyes-hunts-new-team-through-social-media-3644141,Uruguays Gabriel Leyes turned social media find new club free agent strikers transfer deal Deportivo Binacional Peruvian Liga 1 fell apart due age nationality quotas For managerial reasons able sign team despite travelled everything agreed quota issue allow registration Leyes leaving Academia Cantolao social media Wednesday free status waiting new direction 33yearold striker told news outlet Infobae problems transfers due Peruvian Football Federation allowing registration 27 players age 21
364,https://www.channelnewsasia.com/sport/former-barcelona-and-inter-midfielder-luis-suarez-dies-aged-88-3616616,Former Barcelona Inter Milan midfielder Luis Suarez Spanishborn mens footballer Ballon dOr died age 88 clubs Sunday Suarez joined Barca 1955 Ballon dOr soccers prestigious individual trophy claiming league cup double Catalan side 1959 He 32 caps Spain part squad European Championship 1964 Luis Suarez Miramontes died Sunday Milan age 88 Barcelona statement Affectionately known Luisito considered everyone best players history Spanish football well key part Barca second half 1950s
365,https://www.channelnewsasia.com/sport/sabalenka-fights-back-avoid-upset-3613796,Second seed Aryna Sabalenka Belarus recovered poor first set beat Varvara Gracheva 26 75 62 Friday reach third round Wimbledon Australian Open champion struggled badly opening set Gracheva representing France first time since switching nationality Russia last month moving around ease sunshine Court One Sabalenka 25 sent forehand wide tramlines sixth game 16 unforced errors set hand early break 22yearold saved three break points extend lead breaking take set
366,https://www.channelnewsasia.com/sport/djokovic-swiatek-begin-title-quests-easy-wins-rain-hit-wimbledon-3602811,Australian maverick Nick Kyrgios pushed Djokovic hard last mens final whose spiky presence inevitably spices fortnight missing pulled wrist injury eve slam But Wimbledon remains rich plots least Djokovics quest match Margaret Courts record 24 Grand Slams equal Federers eight Wimbledon crowns move alongside Swiss Bjorn Borgs record five successive titles Serbian began serene fashion although mystified everyone else lengthy stoppage light rain got onto surface roof slid shut It strange hour situation changing better Djokovic told reporters Hopefully theyll fix starts raining cant play roof thats little bit issue schedule
367,https://www.channelnewsasia.com/world/andrew-tate-sent-trial-human-trafficking-romanian-prosecutors-3574336,Romanian prosecutors sent social media influencer Andrew Tate brother Tristan suspects trial Tuesday Jun 20 charges human trafficking rape forming criminal gang sexually exploit women Tate brothers Romanian female suspects house arrest pending criminal investigation abuses committed seven women accusations denied brothers former kickboxers United States British nationality highest profile suspects sent trial human trafficking Romania Tate millions online fans mostly young men follow promotion ultramasculine luxurious lifestyle Critics accuse misogyny
368,https://www.channelnewsasia.com/singapore/egyptian-sales-director-molest-woman-marina-bay-sands-claim-drunk-3798871,An Egyptian man conference herded women lift Marina Bay Sands molested lifting shirt insulting modesty Wael Mohamed Abdelmagid Ibrahim Kandil 38 pleaded guilty Monday Sep 25 count molestation insulting womans modesty A third count using criminal force pushing victim lift considered sentencing court heard Wael director sales Simply Gourmet company based United Arab Emirates He week April 2023 conference At 3am Apr 29 36yearold Vietnamese woman 39yearold Singaporean woman entrance lift lobby outside restaurant bar Ce La Vi 57th floor Marina Bay Sands
369,https://cnaluxury.channelnewsasia.com/people/singapore-architect-goy-zhenru-244406,Visiting unique sites work de rigueur architects many say trekked Himalayas research This Goy Zhenru 2023 firm Goy Architects engaged refurbish iconic Hotel Everest View hotel worlds highest mountain range every guestroom view Mount Everest neighbouring alabaster peaks I received call Sonia Miyahara asking would like work hotels refurbishment immediately jumped yes Zoom call recalled Goy Nepali architect Manish Kayastha seen projects magazine recommended firm Miyahara Hotel Everest View developed 1970s Miyaharas father late Takashi Miyahara designed Japanese architect Yoshinobu Kumagaya It situated Syangboche Kumbu region Nepal within Sagarmatha Everest National Park UNESCO World Heritage Site The hotel offers 360degree views Himalayas mountain range includes Mount Everest 8848m sea level Miyahara previously worked returned Nepal help family business It aspiration make Hotel Everest View best mountain hotels world shared Goy
370,https://www.channelnewsasia.com/sport/eight-russian-judokas-barred-world-championships-after-ukraine-boycotts-3459066,Explaining decision ban eight members Russian team IJF Only athletes employed Federal Training Sport Center representative teams Russia athletes information identified suggesting support views Russian invasion Ukraine approved We strive ensure athletes regardless nationality background opportunity compete level playing field without discrimination Among Russian judokas listed world championships Inal Tasoev title world military championships Paris 2021 Mikhail Igolnikov third under90kg category championships Tamerlan Bashaev beat Ukrainian take heavyweight bronze Tokyo Olympics 2021 60kg world champion Yago Abuladze
371,https://www.channelnewsasia.com/singapore/man-jailed-fined-for-harbouring-overstayer-who-used-premises-ica-806851,Italian fashion designer Roberto Cavalli whose penchant python flamboyant animal prints made darling international jet set decades died Friday Apr 12 83 news media Italian news agency ANSA reported designer died home Florence city born long illness First seen 1970s stars Sophia Loren Brigitte Bardot skinbaring eyepopping styles still favoured later generations celebrities Kim Kardashian Jennifer Lopez Cavalli taste Ferraris fat cigars tailored shirts unbuttoned expose tanned chest He married Miss Universe runnerup owned purple helicopter Tuscan vineyard firstname basis Hollywood Alisters
372,https://cnaluxury.channelnewsasia.com/experiences/braci-mirko-febbrile-michelin-chinatown-hawker-stall-pop-italian-food-205836,Starting new restaurant lengthy affair You might find waiting perfect space come along relevant permits come What waiting pieces fall steadily place In Italian chef Mirko Febbriles case use time bring taste Italy Chinatown hawker stall monthlong popup former chef de cuisine Italian restaurant Braci whose helm earned Michelin star joined Lo Behold Group September 2021 Plans underway restaurants come lead happens Febbrile keeps busy laying foundations new establishments says grounded inclusivity authenticity It philosophy inspired native Puglia openness generosity shown
373,https://www.channelnewsasia.com/sport/jerebko-seeking-answers-after-swedish-ban-joining-cska-moscow-3603216,Swedish former NBA player Jonas Jerebko still looking answers future year suspended countrys basketball association following decision join CSKA Moscow wake Russias invasion Ukraine Jerebko regrets decision join club Russia calls actions Ukraine special military operation hindsight mistake far met silence Swedish Basketball Association SBL hadnt played basketball almost year half felt like offers Jerebko told Reuters interview central Stockholm got offer CSKA Moscow took At time thinking basketball went completely wrong regret could go back time would done
374,https://www.channelnewsasia.com/singapore/richard-branson-live-debate-k-shanmugam-drugs-death-penalty-mha-singapore-3020736,Ministry Home Affairs MHA invited British billionaire Richard Branson live televised debate minister K Shanmugam countrys approach towards drugs death penalty Branson vocal views Singapores death penalty crimes drug trafficking recently blog post Oct 10 Earlier year spoke execution convicted drug trafficker Nagaenthran Dharmalingam In response blog post MHA media release Saturday Oct 22 made false assertions alleged racial bias treatment defence lawyers ministry reiterated Singapores stance drugs saying capital sentence clear deterrent effect drug traffickers
375,https://cnalifestyle.channelnewsasia.com/entertainment/reborn-richs-song-joong-ki-dating-again-and-he-might-be-seeing-british-woman-344826,Do hear Its sound hearts breaking revealed Song Joongki relationship And get Vincenzo actor apparently made official right It reported Allkpop Song introduced girlfriend staff members media conference held Dec 7 If records correct could Coliseum Hard Rock Hotel Resorts World Sentosa town promote Reborn Rich South Korean actor stranger made eight trips count sunny island South Korean websites Soompi Allkpop reported seeing British woman His agency HighZium Studio confirmed Dec 26 Song indeed dating though mention nationality
376,https://cnalifestyle.channelnewsasia.com/entertainment/paul-haggis-detained-italy-sex-assault-case-italian-media-317406,Film director Paul Haggis detained Sunday Jun 19 investigation allegations sexually assaulted woman southern Italy Italian news media quoting local prosecutors Canadaborn Oscarwinning Haggis 69 Italy film festival begins Tuesday Ostuni tourist town Puglia region forms heel Italian peninsula news agency LaPresse several Italian media carried written statement prosecutors nearby city Brindisi investigating allegations young foreign woman forced nonconsensual sexual relations days
377,https://www.channelnewsasia.com/world/world-faces-turning-point-ukraines-zelenskyy-warns-leaders-davos-2701236,renaming Russia House example transformation Russia done becoming state war criminals brings world It inspires potential aggressors act Ukrainian former world boxing heavyweight champion Wladimir Klitschko demanded sanctions target Russian athletes Here Switzerland headquarters IOC International Olympic Committee believe Russian Olympic team must banned participate Nothing nationality athletes represent regime Russia aggressive regime started senseless war
378,https://www.channelnewsasia.com/singapore/zhao-zheng-former-deputy-lead-moh-data-unit-jailed-osa-leak-covid-19-numbers-2512291,A former deputy lead Data Management Unit set Ministry Health MOH combat COVID19 pandemic leaked daily number COVID19 cases chat group 50 people even offering small prize managed predict figures Zhao Zheng 37yearold citizen sentenced 18 weeks jail Tuesday Feb 22 She pleaded guilty 12 charges mostly wrongful communication information Official Secrets Act Another 12 charges taken consideration court heard Zhao working assistant director Biostatistics Research Branch Public Health Division MOH pandemic broke
379,https://www.channelnewsasia.com/asia/japan-denies-receiving-sensitive-vaccine-information-who-director-accused-abuse-2465851,He Japan takes seriously importance maintaining equal fair access safe effective highquality vaccines countries regions Japanese government providing support cooperation COVAX international cooperative program formed make sure low middleincome countries fair access COVID19 vaccines well WHO related governments Since June 2021 Japan provided 42 million doses COVID19 vaccine 176 million doses COVAX 246 doses via bilateral deals Australian Health Minister Greg Hunt Friday unaware allegations Kasai reading media reports would seek briefing WHO He suggested WHOs internal processes examining significant allegations would benefit kind external oversight We asking WHO independent advice nature response claims Hunt
380,https://edition.cnn.com/2024/03/23/uk/catherine-princess-of-wales-profile-gbr-intl/index.html,Catherine Princess Wales revealed cancer undergoing preventative chemotherapy weeks speculation health absence public eye In statement called news shock asked privacy young family She undertaking public duties since abdominal surgery earlier year 42yearold princess known Kate key member slimmeddown royal family wife future king mother nextinline throne admired popular figure right She become important British royals since Harry Meghan quit senior royals Prince Andrew became engulfed scandal death Queen Elizabeth II
381,https://www.channelnewsasia.com/sport/forest-sign-swedish-forward-elanga-united-3652721,Nottingham Forest signed Swedish forward Anthony Elanga fiveyear deal Manchester United Premier League clubs announced Tuesday 21yearold Sweden international came Uniteds youth ranks making 55 appearances across competitions Old Trafford outfit Elanga capped 12 times Sweden clubs disclose financial details British media reported Elanga joined Forest deal worth 15 million pounds 1927 million Its pleasure Its proud moment family well Elanga statement Its perfect next step career interest elsewhere Nottingham Forest feels like perfect place
382,https://cnalifestyle.channelnewsasia.com/entertainment/nicholas-tse-giving-canadian-nationality-278546,Hong Kongborn actor singer Nicholas Tse revealed Sunday Sep 5 process giving Canadian citizenship He made announcement China Central Television CCTV programme Perception Room 41yearold Tse whose current film Raging Fire enjoying great success moment programme come across online comments movie people questioning nationality saying hes Canadian I wondered would say that Tse adding comments made heart skip beat He always Chinese national born Hong Kong always wanted spread Chinese culture spirit world food music action movies
383,https://www.channelnewsasia.com/singapore/stanchart-robber-david-roach-caning-sentence-remitted-uk-2065591,Standard Chartered Bank robber David James Roach caning sentence set aside fulfil assurance given UK extradition proceedings No alternative punishment imposed Roach lieu caning Ministry Home Affairs MHA Sunday Jul 25 Canadian national 31 fled Thailand robbing Standard Chartered branch Holland Village S30450 Jul 7 2016 He detained Thailand deported Canada 2018 held British police transit put arrest request
384,https://www.channelnewsasia.com/asia/singapore-durian-seller-owen-road-free-meals-malaysians-cabbies-1996111,With durian season hitting peak last couple weeks Louis Lee feels grateful bounty fruits gets sell 31yearold Malaysian owns operates durian stall Owen Road seen spike business profits amid bumper crop thorny fruit coming Johor Pahang Contented additional income decided help groups people whose lives adversely impacted COVID19 pandemic In interview CNA shop Tuesday Jun 29 Lee counting lucky stars spite pandemic still earned good living
385,https://cnalifestyle.channelnewsasia.com/entertainment/influencer-oli-london-identifies-as-korean-surgery-bts-jimin-270571,A British influencer gone 18 surgeries eight look like BTS Jimin Oli London identifies nonbinary uses pronouns theythem released video YouTube underwent racial transitional surgery identified as Korean Im finally Korean video Tuesday Jun 29 I know lot people dont understand identify Korean look Korean feel Korean Thats culture Thats home country Thats exactly look now London 330000 followers Instagram wanted known Jimin And identify Jimin thats Korean name
386,https://www.channelnewsasia.com/sport/football-fifa-rejects-el-haddadi-bid-switch-morocco-spain-747216,FIFA rejected request Moroccan soccer federation let Munir El Haddadi change nationality Spain despite easing eligibility rules last month decision challenged Morocco player Court Arbitration Sport soccers world governing body Thursday Any appeal would second Morocco El Haddadi FIFA sports highest court They lost previous ruling weeks 2018 World Cup case factor FIFA revisiting national eligibility rules players Two ago FIFAs rules bound El Haddadi Spain played single competitive game senior national team As 19yearold Barcelona player 2014 late substitute European Championship qualifying game
