,Link,clean_text
1121,https://nuhsplus.edu.sg/article/living-with-family-but-socially-isolated,They always say research serendipity stars aligned Prof Koh WoonPuay lead principal investigator recentlypublished study social isolation elderly clinicianscientist working previous project ageing decided stroke inspiration collect data social support living arrangements well study focused primarily medical aspects ageing cognition function ordinarily shed reason collect data But reasoned physical data alone isnt sufficient produce holistic picture ageing After peoples social lives affected health vice versa
1122,https://www.nuhsplus.edu.sg/article/meet-the-allied-health-heroes-making-their-mark-at-nuhs,With 15 experience dietitian Dr Lew knows fully well importance research ensuring effectiveness nutrition plans patient There prior evidence patients critical care getting right nutrition hindered recovery There lack research area prompted involved end explained Dr Lew That throughout heavily involved critical care nutrition research 25 research publications date Dr Lew added In area critical care evidence nutrition therapy ever evolving skills evaluate research findings modify current nutrition therapy key Otherwise could perpetually providing suboptimal care
1123,https://www.nuhsplus.edu.sg/article/into-the-depths-of-metabolic-disease,As spotlight obesity grows many researchers trying get bottom complex disease And key understanding obesity according endocrinologist Asst Prof Khoo Chin Meng humans Every human different created differently different metabolic rates explained Asst Prof Khoo Head Senior Consultant National University Hospitals Department Endocrinology Assistant Professor National University Singapores NUS Yong Loo Lin School Medicine NUS Medicine So want understand obesity within person need conduct phenotyping understand physiology first But its simple
1124,https://www.nuhsplus.edu.sg/article/new-bacteria-species-identified-named-by-singapore-scientists,With S aureus every us time life sure infected Its impossible escape AProf Raymond Lin Head Senior Consultant Microbiology Department Laboratory Medicine NUH So question scientists must answer whether S singaporensis likely cause mild severe disease whether less dangerous AProf Lin added For instance teams assessment pathogen far based comparison S aureus But know S singaporensis might carry set peculiar virulence dont know that Dr Jeanette Teo Principal Scientific Officer Microbiology Department Laboratory Medicine NUH
1125,https://www.nuhsplus.edu.sg/article/new-treatment-technique-could-help-end-stage-cancer-patients-live-longer,Since introduced hospital December 2016 NUHS carried 49 PIPAC procedures 31 patients zero mortalities It main training centre PIPAC Asia As still clinical trials technique currently used exclusively endstage peritoneal cancer patients However positive results could mean extension treatment earlierstage cancer patients even cancers parts body Prof So team working studies increase techniques effectiveness So far successfully determined optimal dosage oxaliplatin chemotherapy drug currently used PIPAC order minimise side effects maximise results study published Clinical Cancer Research journal months ago guidelines since adopted institutions worldwide
1126,https://www.nuhsplus.edu.sg/article/new-programme-aims-to-help-reset-your-heart-health,According paper researchers Cardiovascular Metabolic Disease Translational Research Programme CVMD TRP Yong Loo Lin School Medicine National University NUS Medicine Department Cardiology National University Heart Centre NUHCS National University Health System NUHS published Lancet Regional Health Western Pacific number heart attacks projected rise nearly threefold 1944 482 cases per 100000 population 2025 1418 per 100000 population 2050 Year year see people admitted hospital heart failure Prof Roger Foo Director CVMD TRP NUS Medicine Cardiovascular Research Institute NUHCS revealed
1127,https://www.channelnewsasia.com/business/investment-reverse-ageing-research-biotech-3182226,SINGAPORE Big investors zeroing age reversal research biotechnology firms massive funding accelerating pace studies Hong Kongbased Insilico Medicine among biotech firms benefitting interest Multiple investors poured US400 million support firm since 2014 Among biggest backers Pavilion Capital wholly owned subsidiary Singapores sovereign wealth fund Temasek Holdings Dr Alex Zhavoronkov chief executive Insilico Medicine major hubs longevity research Singapore betting future technologies attracting top scientists world
1128,https://www.nuhsplus.edu.sg/article/holomedicine-technology-research-nuhs,Enter holographic technology aims solve problems In collaboration Microsoft German software developer apoQlar NUHS embarked research development programme explore use mixed reality MR technology cuttingedge amalgam virtual augmented reality clinical care As part programme neurosurgeons NUHS assessing use MR help locate brain tumours operating patients instead via conventional neuronavigational systems distracting inconvenient Under MRaugmented approach surgeons wear holographic visors secondgeneration devices developed Microsoft dubbed HoloLens 2 use superimpose brain scans directly patients head
1129,https://www.channelnewsasia.com/sustainability/resorts-world-sentosa-nus-living-laboratory-launch-biodiversity-conservation-decarbonisation-research-2416256,SINGAPORE Resorts World Sentosa RWS National University NUS announced setting laboratory biodiversity conservation decarbonisation research RWS NUS launched 5year applied research partnership Wednesday Jan 5 set collaborative RWSNUS Living Laboratory joint media release RWS committed S10 million funding support Living Laboratory research laboratory seeks contribute towards Green Plan 2030 well Sentosa Development Corporations plans transform island carbonneutral destination 2030 RWS NUS
1130,https://nuhsplus.edu.sg/article/rehabilitating-stroke-through-acupuncture,Unfortunately doubleblinding isnt possible acupuncture placebo treatment challenge faced surgical field Unlike surgery however its far difficult alternative therapy obtain resources needed research Furthermore acupuncture rarely used standalone treatment A diagnosis TCM often results individualised treatment plan combined forms therapy herbal medicine This makes precise effects even harder isolate posing even greater challenge research And studies conducted recent we still enough evidence Western medicine standards Dr Qiao
1131,https://www.channelnewsasia.com/world/scientists-get-creative-carry-research-during-covid-19-pandemic-240776,SAN LORENZO Biologist Claudio Monteza pushed thick vegetation install camera near Panamanian highway dense tropical rainforest Securing device tree forest floor checked field vision camera others set provide insights animals steer clear highways ones apt check findings could someday help transportation officials better protect wildlife worlds biologically diverse environments But highway study was initial plan Monteza whose career upended last year COVID19 stranded native Panama suspended research Because pandemic many scientists innovate look alternatives
1132,https://www.nuhsplus.edu.sg/article/robots-in-the-operating-theatre-boon-or-bane,While empirical data may suggest robotassisted kneereplacement surgeries lead better patient outcomes clinicians stressed still need research done More longterm data required evaluate whether added precision translates better patient outcomes shared Dr Ng Asst Prof Wang agreed stressing need more longterm welldesigned studies confirm beneficial effects incorporating robotics knee replacement surgery lack longterm data largely owes fact introduction robots knee replacement surgeries fairly new breakthrough But time research data clinicians eventually gain better understanding devices used achieve best results patients
1133,https://www.channelnewsasia.com/sustainability/climate-change-impact-singapore-research-programme-launch-2803421,SINGAPORE A S235 million programme better understand longterm impact climate change launched Centre Climate Research CCRS programme titled Climate Impact Science Research Programme focus five key areas Sea level rise water resource flood management biodiversity food security human health energy crosscutting research bridge sciencepolicy translation Minister Sustainability Environment Grace Fu announced launch speech Tuesday Jul 12 World Climate Research Programmes Sea Level 2022 Conference She programme would bring together research climate impact science
1134,https://www.nuhsplus.edu.sg/article/she-conducts-medication-reconciliation-like-a-detective,next appropriate steps would get patient started various medications part treatment plan Again newly introduced medication must interact counteract patients usual medication could potentially lead complications explained Ms Ng 31yearold study pharmacy medication empowers knowledge help others She drawn field work due interest sciences awarded Healthcare Scholarship Ministry Health study pharmacy I felt stars aligned went ahead professional degree Subsequently personal mission wanting help others kept frontline field shared
1135,https://www.channelnewsasia.com/singapore/ntu-hyundai-motors-sign-research-agreement-electric-vehicle-manufacturing-2151906,SINGAPORE Nanyang Technological University NTU announced Thursday Sep 2 entered agreement Hyundai Motor Group series joint research projects focusing advanced solutions electric vehicle manufacturing agreement signed Wednesday Professor Lam Khin Yong NTUs senior vice president research Hyundai Motor Groups senior vice president Hong Bum Jung research focus advanced solutions manufacturing electric vehicles develop future mobility solutions NTU news release Focusing Industry 40 technologies projects aim develop solutions transform conventional car manufacturing facilities stateoftheart factories future
1136,https://www.nuhsplus.edu.sg/article/waistline-a-better-indicator-of-health-than-bmi-for-seniors-study,It observation older patients compromising health bid obtain healthy BMI persuaded AProf Merchant investigate different potentially safer indicator obesity waist circumference Waist circumference measure central obesity factor reflective visceral fat In recent central obesity gaining popularity indicator health multiple studies comparing favourably BMI However studies far focused seniors AProf Merchant information gap sought fill Published December 2021 AProf Merchants study surveyed 754 participants aged 65 Among findings study showed patients central obesity regardless BMI likely suffer chronic diseases like hypertension diabetes even underweight
1137,https://www.channelnewsasia.com/asia/anti-muslim-hate-speech-soars-india-research-group-says-4149141,AntiMuslim hate speech India rose 62 per cent second half 2023 compared first six months year Washingtonbased research group Monday Feb 26 adding IsraelGaza war played key role last three months India Hate Lab documented 668 hate speech incidents targeting Muslims 2023 255 occurred first half year 413 took place last six months 2023 research group report released Monday About 75 per cent 498 incidents took place states governed Hindu nationalist Bharatiya Janata Party BJP Prime Minister Narendra Modi according report states Maharashtra Uttar Pradesh Madhya Pradesh accounted hate speech
1138,https://www.nuhsplus.edu.sg/article/why-it-s-important-to-cultivate-healthy-habits-in-young-children,children studied part Growing Up Towards Healthy Outcomes GUSTO cohort study began 2008 Gusto study collaboration ASTARs Institute Clinical Sciences SICS KK Womens Childrens Hospital National University Health System National University NUS aims investigate effects pregnancy early childhood conditions health development mothers children In new study researchers tracked children across three time points ages five eight caregivers reporting childs lifestyle behaviours including screen time physical activity dietary intake among others
1139,https://www.nuhsplus.edu.sg/article/why-resistance-training-is-key-to-reducing-risk-of-diabetes,While factors old age obesity smoking unhealthy diet often associated diabetes risk recent study conducted researchers National University Hospital NUH Yong Loo Lin School Medicine National University NUS Medicine found weak muscle strength linked prevalence diabetes among midlife women study conducted last year 1170 Chinese Malay Indian women participants ages 45 69 found midlife women poor muscle strength times risk developing diabetes compared normal muscle strength This association independent known risk factors diabetes
1140,https://www.straitstimes.com/singapore/s-pore-studying-safety-of-deploying-nuclear-energy-in-small-densely-populated-areas,This includes engaging international organisations partners deepen understanding evolving nuclear technologies facilitate information sharing These organisations include International Atomic Energy Agency United Nations agency promotes safe secure peaceful use nuclear technologies UK Atomic Energy Authority researches fusion energy Max Planck Institute Germany German institute houses futuristic Wendelstein7X worlds largest stellarator experimental reactor nuclear fusion reactions EMA spokesman added working regional neighbours Asean platforms build regions capabilities nuclear safety emergency preparedness response
1141,https://www.straitstimes.com/world/europe/climate-science-in-arctic-broken-as-us-and-europe-isolate-russia,TROMSO Norway Dr Irina Panyushkina dendrochronologist scientist studies treering dating understand past environmental conditions University Arizona In early 2022 planning summer fieldwork Siberia research links climate change Russias freshwater systems Arctic ice formation Her work already delayed Covid19 Then Russia invaded Ukraine slammed halt Dr Dmitry Nicolsky geophysicist University Alaska Fairbanks researches thawing Arctic permafrost managed stay touch Russiabased colleagues war started unfold But time contact stopped key informationsharing
1142,https://www.nuhsplus.edu.sg/article/are-you-taking-your-vitamins-the-correct-way,term vitamins coined Dr Casimir Funk Polish biochemist studying certain properties food seemed prevent nutritional diseases beriberi Vitamin B1 deficiency scurvy Vitamin C deficiency This class organic compounds seemed vital life named vitamines  term evolved know vitamins Both vitamins minerals micronutrients needed small amounts bodies function properly 13 essential vitamins Vitamins A C D E K B group vitamins B1 B2 B3 B5 B6 B7 B9 B12 found organic sources plants animals minerals inorganic elements originate earth water Both vitamins minerals play specific roles bodily functions corresponding deficiencies linked range health issues including greater susceptibility illness due weak immune system
1143,https://www.nuhsplus.edu.sg/article/can-a-mother-s-nutritional-intake-impact-the-long-term-health-of-her-baby,One strengths study diversity participants involved women multiple ethnicities general population across three countries means outcomes wide relevance women planning pregnancy AProf Chan Additionally study included blinded intervention control groups bias minimised primary outcome paper published journal Diabetes Care earlier year study developed led investigators multinational EpiGen Academic Research Consortium counts among members NUH well National University Institute Clinical Sciences ASTAR collaboration Nestlé Research
1144,https://www.nuhsplus.edu.sg/article/hydroxychloroquine-throat-spray-shown-to-reduce-risk-of-covid-19-infection-nuhs-study,Two widelyused therapies oral hydroxychloroquine povidoneiodine throat spray found significantly reduce risk COVID19 infection according study team NUHS clinicianscientists Conducted 3037 healthy migrant workers quarantined Tuas South Dormitory last year trial randomly assigned participants receive sixweek preventive course five therapies oral hydroxychloroquine povidoneiodine throat spray oral ivermectin oral zinc vitamin C combination oral vitamin C Vitamin C used comparator medication due popularity remedy pandemic scientists results showed hydroxychloroquine throat spray reduced infection rates 21 24 per cent respectively compared vitamin C regimen
1145,https://www.nuhsplus.edu.sg/article/new-minimally-invasive-techniques-for-pulmonary-embolism-could-lower-risks-cut-hospital-stays,Over last seven weve trying eat spaghetti spoon Asst Prof Pipin leads newlyformed Pulmonary Embolism Response Team PERT aims improve treatment PE He explained given lack options team initially resorted using tools used treat conditions tackle clots However due vast differences organ anatomy artery heart instance 4mm diameter artery lung ten times wide method used last resort
1146,https://www.nuhsplus.edu.sg/article/new-scalp-cooling-therapy-could-reduce-hair-loss-in-cancer-patients,It desire help alleviate patients distress led NCIS team study eventually introduce scalp cooling therapy patients Our aim always make sure patients get best treatment cure cancers Dr Lim explained But were already stage were looking beyond treating cancer really want take care patient whole therapy works reducing temperature scalp immediately administration chemotherapy Patients wear cold cap lowers scalps temperature 18 22 degrees Celsius constricting blood vessels reducing effect chemotherapy hair follicles
1147,https://www.nuhsplus.edu.sg/article/shedding-light-on-menopausal-joint-pain,According studies conducted 2023 Integrated Womens Health Programme IWHP National University Hospital NUH National University Yong Loo Lin School Medicine NUS Medicine aches pains muscles joints rank top complaint among menopausal women These studies found issue affects 30 per cent 40 per cent women country problem Most doctors around world recognise joint pain symptom menopause Menopausal joint pain known arthralgia condition clinicians globally well aware of highlighted Professor Yong Eu Leong Emeritus Consultant NUHs Department Obstetrics Gynaecology
1148,https://www.channelnewsasia.com/singapore/research-study-long-covid-19-unvaccinated-survivors-higher-risk-heart-complications-3834091,study led Nanyang Technological University NTU published Clinical Infectious Diseases academic journal Sep 25 first largest examine risk long COVID highly vaccinated multiethnic Southeast Asian population NTU news release Oct 9 study found 912 106012 patients unvaccinated recovered COVID19 reported lingering aftereffects consistent long COVID syndromes may include fatigue shortness breath memory problems heart complications cardiovascular cerebrovascular thrombosis study carried researchers Lee Kong Chian School Medicine LKCMedicine Ministry Health General Hospital National Centre Infectious Diseases
1149,https://www.channelnewsasia.com/commentary/space-mars-pregnancy-reproduction-human-babies-ethics-research-3477621,distances Mars Earth great limited numbers favourable launch opportunities If permanent Martian settlement scale established maintained seems likely women need get pregnant give birth beyond Mother Earth Moreover human history guide reasonable conclude longterm cohabitation men women Mars inevitably result pregnancies In early preparation researchers Department Obstetrics Gynaecology NUS Yong Loo Lin School Medicine started joint programme local space organisation Space Technology Ltd study radiation microgravity affect human reproductive system
1150,https://www.channelnewsasia.com/cna-insider/singapore-food-agency-selective-breeding-red-snapper-scientists-fish-farmers-research-3383251,For example AquaPolis see scientists look developing superior fingerlings traits faster growth rates lower mortality common fish diseases There need develop methods solutions aquaculture farm fish different farmers region it Dr Jiang Jun Hui director SFAs aquaculture department We need produce intensively sustainably science help us achieve it Ongs Fish Farmer seven farms part AquaPolis His partnership scientists however new
1151,https://www.channelnewsasia.com/singapore/chatbots-help-mental-health-study-suicide-crisis-situations-ntu-3159931,SINGAPORE Chatbots provide comfort people mental health issues fall short comes detecting suicidal tendencies offering appropriate help crisis situations researchers found A study nine mental health chatbots Nanyang Technological University NTU showed empathise users conversations unable understand users express suicidal tendencies offer personalised advice Chatbots computer programmes simulate human conversations increasingly used healthcare They used manage mental health conditions support general wellbeing USING CHATBOTS TO OFFER TIMELY CARE SUPPORT WELLBEING
1152,https://www.channelnewsasia.com/cna-insider/lab-bespoke-drug-treatments-ai-nus-medicine-researchers-cancer-patients-3075161,Chow witnessed progression disease father went the different lines standard therapy ultimately ran options We feel helpless especially treatment regimented wanted see could anything make sure people many options possible He decided switch area research  effects antiviral immune response drug metabolism  cancer clinical impact to give cancer patients families much time together possible
1153,https://www.channelnewsasia.com/cna-insider/milk-nanoparticles-therapy-gut-disease-nus-nanomedicine-fatty-liver-3071541,Nanomedicine field Wang dived curiosity three postdoctoral work heart failure microsurgery A research fellow met developed nanoparticle formulation containing compound extracted Chinese herb compound dissolve well water blood taking large quantities orally would cause digestive problems After several chats Wang decided test formulation laboratory found could repair damaged heart That first time fascinated power nanomedicine
1154,https://www.channelnewsasia.com/singapore/caregivers-face-not-only-burden-reward-and-benefits-their-journey-study-4194761,SINGAPORE One five caregivers find meaning looking loved ones despite facing high caregiving burden according DukeNUS Medical School study As faces ageing population supporting caregivers become vital wideranging study hopes better support caregivers understanding different needs help sector come targeted assistance FINDING PURPOSE IN CAREGIVING Findings extent burdens benefits caregiving shared Wednesday Mar 13 family caregiver symposium event organised DukeNUS Medical Schools Centre Ageing Research Education CARE Tsao Foundation organisation working ageing issues
1155,https://www.channelnewsasia.com/asia/nobel-prize-japan-physics-nagoya-university-3995941,One Nagoya Universitys brightest stars Professor Hiroshi Amano He awarded Nobel Prize physics 2014 inventing lightemitting diode LED semiconductor device enables bright energysaving white light sources LED lighting products commonly used worldwide produce light 90 per cent efficiently incandescent light bulbs With onefourth world electricity consumption used lighting purposes highly energyefficient LED contributes enormous savings energy countries confront climate crisis Prof Amano shared award mentor Isamu Akasaki Japaneseborn American Shuji Nakamura
1156,https://www.channelnewsasia.com/singapore/heart-disease-ong-ye-kung-research-25-million-grant-project-reset-3808636,Led Professor Roger Foo team behind CardiovascularMetabolic Disease Translational Research Programme project received S25 million grant launch team looking iceberg people may look well surface Prof Foo But actually start screening deeply start reveal kinds early signs disease adding studied many different angles Some people living healthy lifestyles today may lulled thinking completely healthy We become aware fitness health thing Prof Foo senior consultant National University Heart Centre
1157,https://www.channelnewsasia.com/singapore/big-read-covid-19-young-people-millenials-generation-z-future-2311476,Assistant Professor Cheung Hoi Shan YaleNUS College researches parenting child development curtailment social interactions schools early age example could impact Were talking kids may grow maybe knowing feels like school camp 50 people But saying past pandemic alter personalities millennials Gen Zers still stretch noted Were talking kids may grow maybe knowing feels like school camp 50 people
1158,https://www.channelnewsasia.com/cna-insider/medicine-kill-dengue-virus-6-hours-nus-immunology-research-3051091,Taking sting dengue manner speaking Associate Professor Paul MacAry set And getting close 10 first breakthrough In 2012 team Immunology Translational Research Programme National University Singapores Yong Loo Lin School Medicine NUS Medicine isolated human antibody screening literally hundreds millions antibodies derived individuals recovered dengue serotype 1 recounted These patients National University Hospital Tan Tock Seng Hospital We saw outlier antibody appeared kill virus within hours concentrations much lower antibodies isolated MacAry director NUS Life Sciences Institute
