,Link,clean_text
718,https://cnalifestyle.channelnewsasia.com/entertainment/natalie-portman-divorce-386551,A representative Portman confirmed American publication People Friday Mar 8 split actress filed dissolution July former couples divorce finalised last month France live children Son Aleph 12 sevenyearold daughter Amalia Portman Millepied married 11 first reported June allegedly cheated actress 25yearold woman named Camille Etienne A source told Page Six pair married 2012 first separated 2022 managed work marital troubles
719,https://cnalifestyle.channelnewsasia.com/entertainment/qi-yuwu-once-upon-new-years-eve-things-tell-younger-self-383171,Yuwus character accepts chance make amends late wife played Jesseca Liu solve mystery broken friendship runins past self Doesnt pose problems spacetime continuum Erm guess well watch show find If really could travel time many periods would want visit mused Yuwu paralysed hypothetical possibility meeting anyone history even teenage self 47yearold born grew Guangzhou China family still lives He moved early 20s winning China round Star Search 1999 picking Personality award Rising steadily leading man status hes earned Best Actor gongs AllTime Favourite Artiste trophy Star Awards
720,https://cnaluxury.channelnewsasia.com/people/felicity-beck-bar-studio-capella-sydney-rosewood-phuket-ritz-carlton-melbourne-241611,Twenty ago Felicity Beck relocated back Australia husband Stewart Robertson New York pursuing respective careers architecture Beck moved ranks Schwartz Architects worked projects iconic Staten Island Ferry Terminal Settling Melbourne couple established BAR Studio amalgamation Beck Robertson received first commission Millennium Hilton Bangkok springboard decades successful hospitality interior design In town September attend FIND Design Fair Asia celebrated showcase regional international design Beck shares moving Melbourne taking first project best decisions Robertson made
721,https://cnaluxury.channelnewsasia.com/people/sheena-liam-malaysian-model-embroidery-artist-241586,Sewing something Liam picked seamstress mother growing suburb Klang Valley although wasnt something immediately drawn I grew Kajang Malaysia lived led normal SJKCSMK government public school life My mom trained seamstress around sewing machines lot loud sounds machines always stressed out recalled Fashion fashion magazines entertainment escapism teenage girls growing up Liams first exposure modelling began scouted cover girl search teenage magazine age 15 However parents looked dimly forbade join Nevertheless got callbacks magazine started shooting editorials parttime fun
722,https://cnalifestyle.channelnewsasia.com/entertainment/shakira-reaches-deal-prosecutors-spain-tax-fraud-trial-378861,Spain cracked soccer stars Lionel Messi Cristiano Ronaldo past decade paying full taxes former Barcelona Real Madrid stars found guilty evasion avoided prison time sentences suspended Shakira whose full name Shakira Isabel Mebarak Ripoll children Milan Sasha Barcelona soccer star Gerard Piqué couple lived together Barcelona ending 11year relationship last year Since resided Miami After triumphing Latin Grammy Awards gala Seville Thursday Shakira thanked fans Spain being good times bad
723,https://cnalifestyle.channelnewsasia.com/entertainment/shakira-tax-fraud-trial-spain-378826,Shakira 46 lived former Barcelona Spain soccer star Gerard Pique 11 couple children singer whose full name Shakira Isabel Mebarak Ripoll moved Miami separation Judge Jose Manuel del Amo Sanchez handled highprofile cases chair panel three judges set hear 100 testimonies course trial due start 10am 5pm time Spanish authorities pursued major celebrities tax evasion including soccer players Portugals Cristiano Ronaldo Argentinas Lionel Messi BrazilianSpanish player Diego Costa All settled paid large fines
724,https://www.straitstimes.com/singapore/ex-singaporean-actor-ix-shen-returns-to-war-torn-ukraine-to-help-with-humanitarian-aid,Former Singaporean actor Ix Shen returned Ukraine help humanitarian aid part volunteer group 50yearold previously left home Ukraine Poland last month Russia invaded country He living capital city Kyiv Ukrainian wife four months couple fled Kyiv Russian attacks intensified Shen posted Instagram reaching Poland reassure followers safe In Instagram video posted last Friday April 8 resides safe place Ukraine reveal exact location security reasons
725,https://www.straitstimes.com/asia/east-asia/woman-in-china-travels-1600km-to-pick-up-mother-for-chinese-new-year-reunion,story university student Chongqing flew 1600km pick mother take back home upcoming Chinese New Year gone viral China Peoples Daily reported According video posted Ms Li Qiushuang parents went work Fujian province 20 ago Every year Spring Festival would return Chongqing together However 2024 due grandmothers illness Ms Lis father returned home town early leaving mother alone Jinjiang Fujian works shoe factory Over video call Ms Lis mother told daughter would coming home festive period year On hand mother wanted earn money hand might difficult travel alone familiar public transport
726,https://www.straitstimes.com/sport/all-change-for-indias-sindhu-in-push-for-olympic-gold,A new coach new mentor new home Indias PV Sindhu overhauled life allout bid land Olympic badminton gold Paris settle silver bronze previous Games She Bengaluru India far Hyderabad trained career highlights include bagging singles silver Rio 2016 bronze Tokyo crowned world champion 2019 move October deemed essential Sindhu wanted closer new mentor Prakash Padukone Indian badminton great father Bollywood superstar Deepika Padukone
727,https://cnalifestyle.channelnewsasia.com/entertainment/cillian-murphy-moves-ireland-live-quiet-life-383921,Cillian Murphy moved London desperate live quiet life away showbiz glare Oppenheimer actor 47 striding red carpets months thanks nowOscar nominated portrayal nuclear physicist J Robert Oppenheimer Christopher Nolans Oppenheimer epic expected sweep board years Academy Awards But source personal hatred showy side star would far rather indulge passion listening music fourstorey sixbed Victorian family home Ireland shares 51yearold artist wife Yvonne McGuinness married 2004 children sons Malachy 18 16yearold Aran
728,https://cnalifestyle.channelnewsasia.com/entertainment/edwin-goh-leaves-mediacorp-380401,Edwin shared hes working retail looks perfume counter department store He taking acting classes Australia hone craft going auditions He didnt mention crocheting Edwin actress girlfriend Rachel Wan moved Sydney earlier year In statement Celebrity Agency TCA We would like share Edwins contract Celebrity Agency come end We wish Edwin best future endeavours look forward working again Edwin received many messages support announcement including celebrity pals Cynthia Koh wrote You always cheering on Romeo Tan wrote Yolo
729,https://cnaluxury.channelnewsasia.com/people/danish-furniture-fritz-hansen-ceo-asia-dario-reicherl-241336,Fritz Hansen big fan patina like materials leather wood furniture get old get patina Dario Reicherl CEO Fritz Hansen Asia natural materials timeworn beauty provided inspiration Releasing perfume may conventional way market furniture Reicherl conform Marketing furniture world extremely conservative little innovation consider extremely boring Italian resided 15 He handles Australasian market 150yearold brand whose iconic pieces Egg armchair Series 7 chair designed Arne Jacobsen become synonymous timeless Scandinavian design Under Reicherls unorthodox leadership regional sales increased fivefold nine
730,https://cnalifestyle.channelnewsasia.com/entertainment/matilda-tao-living-singapore-host-love-972-mediacorp-radio-station-386976,Next time youre market look around theres chance might bump Taiwanese host Matilda Tao At recent press conference Taipei new show 54yearold star revealed shes living 15yearold son aka Little Dragon studying international school since January Matilda shes commuting Taiwan heading United States May 18yearold daughter Dou Dous high school graduation ceremony Meanwhile Matildas husband Taiwanese actor Li Liren 50 alone Taiwan dogs
731,https://www.channelnewsasia.com/asia/malaysia-mothers-citizenship-children-born-abroad-2518226,Children without Malaysian citizenship face many obstacles comes schooling access government health services even ability cross borders meet families Mdm Teoh son could attend national school wait spots filled citizens opening remaining others She send son international school costs RM30000 US7146 per year fees I able save much retirement cybersecurity specialist originally Kuching Sarawak resides Petaling Jaya Selangor
732,https://www.channelnewsasia.com/singapore/when-you-see-him-you-feel-leader-residents-lawrence-wongs-ward-his-qualities-their-mp-2627921,It rainy morning Limbang estate Choa Chu Kang Brian Ang appeared rush But 25yearold resident Limbang enthusiastic share thoughts Member Parliament MP Lawrence Wong man described friendly remarkable Wong MP Limbang ward MarsilingYew Tee GRC Finance Minister Thursday Apr 14 named leader fourth generation 4G Singapores political leadership announcement paves way become countrys next Prime Minister
733,https://www.channelnewsasia.com/asia/malaysia-penang-water-supply-disruption-shutdown-resource-wastage-4036721,Some businesses schools instructed workers students come water shutdown Ms Angela 37yearold marketing executive resides Penang told CNA housing estate affected water shutdown husbands workplaces well childrens schools affected areas We asked work study home glad decision made would prefer kids home home isnt affected water shutdown
734,https://www.channelnewsasia.com/singapore/ns-defaulter-thirumal-pavithran-jailed-study-overseas-875216,Indian national permanent resident Thirumal Pavithran 25 failed register time NS defaulted NS obligations completing secondary university education India total amount time spent outside five seven months 16 days Thirumal finished serving NS last month pleaded guilty four charges Enlistment Act court heard born India became permanent resident June 1997 three old He studied primary secondary schools 2001 2009 left country India continue studies May 2009
735,https://www.straitstimes.com/world/middle-east/residence-of-libyan-pm-targeted-with-rpgs-no-casualties-reported-minister-says,residence Libyan Prime Minister Abdulhamid alDbeibah targeted rocketpropelled grenades Sunday attack left casualties Libyan minister told Reuters minister spoke condition anonymity confirmed message attack caused damage minister disclosed details Two citizens heard massive explosions near sea Tripolis luxury Hay Andalus neighbourhood home PM Dbeibahs residence A citizen massive explosions heard heavy security forces vehicles deployed around area Libya little peace stability since 2011 NATObacked uprising split 2014 eastern western factions rival administrations governing area
736,https://www.channelnewsasia.com/asia/indonesia-electric-motorcycle-subsidy-vehicle-assistance-program-3734736,Another concern electric motorcycle sound person riding motorcycle long time addition rearview mirror hear sound motorcycle maintain driving safety Isa resides Depok expressed wariness whether electric motorcycle truly environmentallyfriendly alternative I think long electricity still generated electric steam power plants still uses coal may even significant impact Not mention problem EV battery waste cannot recycled
737,https://www.straitstimes.com/asia/south-asia/pakistan-ex-pm-khan-s-wife-back-home-after-residence-declared-sub-jail,Late Jan 31 government Bibi transferred home outskirts Islamabad Adiala jail The chief commissioner Islamabad Capital Territory pleased declare residence convict Mst Bushra Bibi subjail Jan 31 till orders read order seen AFP Khan home rambling bungalow large compound surrounded high concrete walls plush Bani Gala area capital Pakistan goes polls Feb 8 ballot already marred allegations rigging Khan barred running Pakistan TehreekeInsaf party subject massive crackdown
738,https://www.straitstimes.com/world/middle-east/iraq-pm-calls-for-calm-after-drone-attack-on-his-residence,Iraqi Prime Minister Mustafa alKadhemi unhurt appealed calm restraint drone attack residence Sunday Nov 7 political tensions mounted country attack Baghdads Green Zone first target residence Kadhemi power since May last year came Iraqs political parties wrangle run next government last months elections That vote saw Conquest Fatah Alliance political arm proIran Hashed alShaabi paramilitary network suffer substantial drop parliamentary seats leading group denounce outcome fraud No group yet claimed responsibility Sundays attack left six members Kadhemis personal protection force wounded security sources
739,https://www.straitstimes.com/world/middle-east/israelis-wonder-when-or-whether-benjamin-netanyahu-will-exit-official-residence,paparazzi eagerly snap shots random moving trucks vicinity prime ministers official residence Jerusalem Political cartoonists portraying Benjamin Netanyahu Israels former prime minister wife Sara elder son Yair squatters And suspicions Netanyahu might reluctant leave stately home lived past 12 bolstered week hosted Nikki Haley former US ambassador United Nations official residence still running show Unlike Washington set time outgoing Israeli premier must move hand house victor often take weeks though Netanyahu family nowhere go Among private residences home seaside town Caesarea
740,https://www.straitstimes.com/sport/new-zealands-jamieson-rested-from-bangladesh-odis,New Zealand paceman Kyle Jamieson rested current ODI series Bangladesh experiencing stiff hamstring return home test tour New Zealand Cricket Monday towering quick bowled four overs second test win Bangladesh Mirpur month missed Sundays 44run victory opening ODI Dunedin He miss final matches series Nelson Wednesday Napier Saturday available T20 series starting Dec 27 Napier Wellington Firebird fast bowler Ben Sears remain squad called injury cover Jamieson
741,https://www.straitstimes.com/world/united-states/american-man-who-lived-in-an-iron-lung-for-70-years-dies,Alexander lived Dallas called lung old iron horse reported British news outlet BBC Bellows drew expelled air cylinder forced lungs expand deflate His death announced fundraising website hailed role model many After contracting polio Alexander received law degree passed bar exam started successful practice organiser GoFundMe page Christopher Ulmer His story travelled far wide positively influencing people around world Paul incredible role model continue remembered Ulmer
742,https://www.straitstimes.com/world/europe/finnish-pm-apologises-for-party-picture-from-official-residence,Finnish Prime Minister Sanna Marin Tuesday Aug 23 apologised picture emerged private party thrown official residence July following public stir partying past week On Monday drug test taken prime minister youngest world leaders came back negative It taken assuage concerns video footage published last week showing singing dancing Finnish celebrities another party This week another image began circulating social media showing wellknown female influencers kissing covering bare breasts Finland sign Prime Ministers official residence Helsinki
743,https://www.channelnewsasia.com/singapore/shanmugam-ridout-road-inequality-empathy-social-mobility-3602736,Law Home Affairs Minister K Shanmugam Monday Jul 3 described personal journey living rental flat residing blackandwhite bungalow illustrate point ability serve people depend ones financial background Ive lived HDB flat rental flat threeroom flat fiveroom flat condominium semidetached bungalows Good Class Bungalows moved Ridout minister My empathy increasingly decrease houses got larger made money Shanmugam speaking parliamentary clarifications rentals blackandwhite bungalows 26 31 Ridout Road Foreign Affairs Minister Vivian Balakrishnan respectively
744,https://www.straitstimes.com/world/middle-east/turkey-frees-israeli-couple-held-for-photographing-presidents-residence,Turkey Thursday freed Israeli couple arrested photographing President Tayyip Erdogans residence Istanbul accused spying allegation denied Israel couples release spurred first conversation countries leaders Mordi Natali Oknin detained Nov 9 A Turk arrested espionage charges staterun news agency Anadolu Their family pair drivers Israels biggest bus company vacation Oknins case became cause celebre Israel whose relations Turkey strained Erdogan championed Palestinian cause
745,https://www.channelnewsasia.com/asia/malaysia-johor-state-election-covid-19-omicron-voters-2490401,As number COVID19 cases Malaysia rises due Omicron variant voters Johor wary upcoming state polls Many believe last thing needed point time election Daniel Cheh 37 resides Kulai many businesses Johor struggling stay afloat due COVID19 especially since borders still closed The last thing need election It unnecessary really waste time money told CNA Cheh know would cast vote polls would look COVID19 situation first
746,https://www.channelnewsasia.com/cna-insider/singaporean-willy-tan-ngo-habibi-yazidi-refugees-iraq-kurdistan-3149426,He California working banking time moved United States 1986 living since wife adult children But incident marked start journey took Kurdistan region Iraq 2016 Today home Zakho small city 200000 people Willy cofounder Habibi International humanitarian organisation providing healthcare education internally displaced persons IDPs  forced homes remain within country  refugees He four Singaporeans living unusual places featured On Red Dot series Are You Only Singaporean Here
747,https://cnalifestyle.channelnewsasia.com/travel/queensland-sunshine-coast-australia-holiday-travel-road-trip-303311,And whats visit Australia without wineries Head Flame Hill Vineyard youll find 500 acres put good use growing varieties red white wine land home herds make grassfed Angus cross beef served Vineyards Deck Terrace enjoy full paddocktoplate experience estate wines If minute visit Clock Shop Montville Its German chalet 4000 European items craftsmanship like Black Forest cuckoo clocks grandfather clocks German handicrafts like music boxes Or prefer collecting artworks look Montville Art Gallery featuring original art 40 regions artists Another haunt beautiful handblown glassworks Illume Creations works artist Tina Cooper resides Montville renowned local artists create illuminating glass sculpture jewellery
748,https://www.channelnewsasia.com/brandstudio/singaporeunknown/geylang,Yinzhou lived Geylang 27 As child bedroom fourthfloor apartment looked back alley My worldview shaped lot things saw streets He fascinated individuals living required go work early hour As got older realised migrant workers lived neighbourhood He witnessed vice raids lorongs near home quiet street lined places worship broken sound sirens screams furious footfall
749,https://www.channelnewsasia.com/asia/johor-state-election-postal-votes-singapore-arrive-malaysia-2556981,ballot papers Thursday transported suitcase Sarawakborn Mohd Hafeez A Jaz 36 resides works 1ThirdMedia Movement volunteer took bus Woodlands 1240pm arrived Larkin Sentral Bus Terminal 150pm via vaccinated travel lane Upon arrival Johor Bahru Thursday Mohd Hafeez underwent several procedures checkpoint including onarrival COVID19 screening test He handed luggage containing postal ballot papers Undi18 volunteer Mandeep Singh 215pm bus terminal I consider charity work help facilitate Malaysians fulfil responsibilities registered voters Mohd Hafeez responsibility entrusted 1ThirdMedia Movement bring ballot papers Malaysia burden
750,https://www.straitstimes.com/world/europe/moving-in-uk-pm-boris-johnson-and-partner-take-up-residence-in-downing-street,Prime Minister Boris Johnson moves official Downing Street residence Monday July 29 joined partner Carrie Symonds spokesman When Johnson entered black door No 10 Downing Street last week Britains new prime minister first nearly half century unaccompanied spouse Instead Ms Symonds former head communications Conservative Party stood nearby staff Asked Johnsons partner would moving 10 Downing Street spokesman PM officially moving today yes partner living She declined give details
751,https://www.straitstimes.com/asia/east-asia/to-stop-his-house-from-being-demolished-man-in-china-pays-s68k-to-move-it-40m-away,Gao Yiping spent 330000 yuan S68800 move threestorey house 40m away original location authorities planning construct road reported Chinese media Jxnewscom Using 1000 wooden sleepers workers took six weeks pull house Duchang county Jiangxi province new location last September Gao living house less year cost million yuan build decorate couldnt bear demolish Gao quoted saying Monday March 26 Based calculations even spend 400000 yuan moving house still cheaper faster building entirely new home added
752,https://edition.cnn.com/travel/this-us-couple-bought-a-house-in-france-unseen/index.html,Ellen Joseph currently plans buy place Paris say theyll continue move apartment 7th arrondissement countryside perhaps spending eight months Paris four months Lonlay lAbbaye future Its kind ideal situation place get away To enjoy everything Paris offer get break noise business Although theyve returned US spend time family friends since relocating intention returning country live point see remaining France rest lives
753,https://www.channelnewsasia.com/commentary/malaysia-pas-test-wills-mosques-political-messages-islam-3395771,Leading agitation royal households PAS president Abdul Hadi Awang rightwing cleric resides east coast Terengganu state PAS After Terengganus Sultan Mizan Zainal Abidin issued decree states religious council banning spread political messages activities Muslim places worship Abdul Hadi appeared pulpit several days later deliver weekly sermon Friday midday prayers Rusila mosque town Marang elected parliamentary representative In Terengganu political leaders activists allowed lead deliver Friday sermons mosques well deliver religious talks without state religious councils permission
754,https://www.channelnewsasia.com/sport/spain-mistakenly-honours-icardis-sister-winning-world-cup-3750451,Ivana Icardi Argentinian celebrity resides Mallorca participated several Spanish reality television shows reacted confusion social media This really happened How could possibly get something like wrong Icardi wrote sharing copy BOEs page name Real Madrid defender Andres reacted news posting X viral meme SpiderMan pointing another SpiderMan However Ivana mistake made charge list honorees Midfielder Aitana Bonmati World Cup player tournament UEFA Player Year name misspelt Tuesdays edition BOE
755,https://www.channelnewsasia.com/asia/anwar-malaysia-food-inflation-cost-living-crisis-3939281,Pensioner Zulkifli Abu Bakar 57 resides Selangor told CNA government must help lower income population Malaysia especially B40 bottom 40 per cent cope increase prices goods rice eggs chicken He subsidised cooking oil sugar difficult get times stores limiting number packs items purchased It difficult retirees like us lower income groups income high When cost living high social issues theft suicide crimes increase government pay serious attention talk parliament
756,https://www.channelnewsasia.com/asia/jb-eateries-hike-prices-roti-canai-ramly-burgers-malaysia-inflation-2899986,Taxi driver Allan Teh resides Kulai works Johor Bahru told CNA think twice dining breakfast lunch shift Maybe instead ordering egg roti canai order plain Teh The price everything increased income choice careful spending added 47yearold price food offerings increased cafes restaurants city Johor Bahru resident Zulkhubri Ali Khan regular Seven Oaks Bakery Cafe Taman Pelangi told CNA noticed outlet tweaked prices menu recent weeks
757,https://edition.cnn.com/travel/article/this-couple-bought-a-rundown-farmhouse-in-portugal/index.html,They originally looking vacation home Alan Andrew originally Pennsylvania Belgian husband Vincent Proost found relocating Portugal full time purchasing abandoned farmhouse region Alentejo couple met blind date London 2006 living UK together around decades began searching new home Europe While neither spent much time Portugal previously Proost interior designer felt might right place suggested spend time exploring country together
758,https://edition.cnn.com/travel/article/couple-renovated-14th-century-italian-home/index.html,Theyre excited adds Especially older daughter She like Dad done time But shes excited realizes wasnt scam So worked out Aside Italian home renovation project Johnsons carefully restoring oneroom schoolhouse Gloucester built 1743 fulltime home I love restoring old buildings wife art teachers everything art project says Doug I talk purchasing old properties luckily good sport comes along ride
759,https://www.channelnewsasia.com/singapore/billion-dollar-money-laundering-case-man-who-jumped-balcony-gets-14-months-jail-4242286,remaining charges taken consideration sentencing These include money laundering helping others apply renew work pass making false statements controller work passes conspiring Wang Junjie use forged documents make false representations officials court heard day raids Aug 15 team police officers arrived Sus residence 16 Ewart Park identified eldest son son later led bedroom door closed locked son asked Su come door Su Instead asked son men
