,Link,clean_text
0,https://edition.cnn.com/2023/09/29/business/starbucks-union-wages/index.html,Starbucks violated federal labor law increased wages offered new perks benefits nonunion employees National Labor Relations Board judge found Thursday decision latest series NLRB rulings finding Starbucks violated labor law efforts stop unions forming coffee shops The issue heart case whether current Board law Starbucks entitled explicitly reward employees participating union activity while falsely telling workers federal labor law forced take action wrote administrative law judge MaraLouise Anzalone It not
1,https://www.channelnewsasia.com/singapore/su-wenqiang-pleads-guilty-billion-dollar-money-laundering-convicted-4234731,first suspect plead guilty Singapores largest money laundering case convicted sentenced 13 months jail district court Tuesday Apr 2 Su Wenqiang 32 admitted 11 charges money laundering possessing proceeds illegal remote gambling offences lying get work passes wife More S3 billion US22 billion assets seized frozen relation case This likely makes largest money laundering operations world Su among 10 suspects arrested simultaneous police raids last August Cambodian national whose passport states Fujian nabbed Good Class Bungalow along Lewis Road Bukit Timah
2,https://edition.cnn.com/2023/05/22/tech/meta-facebook-data-privacy-eu-fine/index.html,Meta fined recordbreaking 12 billion 13 billion European Union regulators violating EU privacy laws transferring personal data Facebook users servers United States European Data Protection Board announced fine statement Monday saying followed inquiry Facebook FB Irish Data Protection Commission chief regulator overseeing Metas operations Europe move highlights ongoing uncertainty global businesses may legally transfer EU users data servers overseas EU regulator processing storage personal data United States contravened Europes signature data privacy law known General Data Protection Regulation Chapter 5 GDPR sets conditions personal data transferred third countries international organizations
3,https://www.channelnewsasia.com/singapore/billion-dollar-money-laundering-case-zhang-ruijin-sentenced-15-months-jail-4302416,SINGAPORE A 45yearold man linked Singapores largest money laundering case sentenced 15 months jail Tuesday Apr 30 Zhang Ruijin ordered forfeit around S118 million assets state This amounts 90 per cent S131 million worth assets originally seized police He fifth 10 accused persons dealt relation case Zhang pleaded guilty Tuesday counts forgeryrelated offences failing satisfactorily account property reasonably suspected benefits criminal conduct
4,https://edition.cnn.com/2024/03/05/politics/liberty-university-fined-campus-safety/index.html,Department Education imposed record 14 million fine Liberty University Christian college located Virginia violations campus safety law officials Tuesday Department Education largest fine ever imposed violating Clery Act requires colleges maintain disclose campus crime statistics security information Liberty University agreed spend additional 2 million improve oncampus safety next Department Education initiated review 2022 receiving complaints alleged college committed violations Clery Act review followed 2021 lawsuit 12 women claimed school created environment increased likelihood sexual assault rape case settled 2022
5,https://www.euronews.com/2024/02/23/judge-convicts-former-austrian-chancellor-sebastian-kurz,After twelve days deliberation Vienna court delivered verdict trial former Austrian Chancellor Sebastian Kurz He convicted making false statements parliamentary inquiry verdict Vienna criminal court followed fourmonth trial case marked first time 30 former Austrian chancellor stood trial He given eightmonth suspended sentence Kurz hailed wunderkind Austrian Peoples Party resigned 2021 following separate corruption probe Prosecutors trial opened October accused 37yearold giving false evidence June 2020 inquiry regarding role setting holding company named OeBAG
6,https://edition.cnn.com/2022/07/21/economy/china-fines-didi-data-law-violation-intl-hnk/index.html,Chinas cyberspace regulator fined Didi Global 8 billion yuan 12 billion Thursday violating cybersecurity data laws putting end yearlong investigation ridehailing giant Cyberspace Administration China CAC statement firm breached countrys cybersecurity law data security law personal information protection law The facts violations laws regulations clear evidence conclusive circumstances serious nature vile statement added Aside 119 billion penalty regulator imposed personal fine 1 million yuan 147000 Didis chairman CEO Cheng Wei president Liu Qing respectively Liu Qing known Jean Liu English
7,https://www.brusselstimes.com/justice-belgium/1011990/two-alleged-leaders-of-vast-drug-trafficking-operation-looking-at-20-years-in-prison,On Thursday Brussels Criminal Courts prosecutor requested 20year prison sentences Alfredo H Indrit K Black Eagle case related large drug trafficking operation She identified Albanian nationals leaders criminal organisation responsible drug trafficking operation Prosecution evidence includes cocaine seizures conducted throughout investigation launched 2020 estimated value 1342 million Alfredo H pinpointed operations heads found connections Italian mafia groups established Limburg heads larger organisation based Majorca They implemented modern business methods sharing resources workforce equipment explained prosecutor
8,https://www.expats.cz/czech-news/article/former-czech-mp-gets-three-year-jail-term-for-multiple-charges-of-rape,Prague 3 District Court morning sentenced former member parliament MP Dominik Feri three prison rapes attempted rape finding guilty counts indictments Feri 27 ordered pay total CZK 500000 financial compensation victims verdict final Feri expected appeal Prague Metropolitan Court An MP TOP 09 party 2017 2021 Feri accused committing acts apartment 2016 Chamber Deputies building later
9,https://www.thelocal.dk/20240311/british-trader-on-trial-in-denmark-for-massive-fraud,Sanjay Shah arrested June 2022 Dubai living accused running ninebillionkroner 132billion scam enabled companies controlled fraudulently claim Danish tax refunds 2012 2015 Shah 53 guilty violate Danish law He faces 12 prison Glostrup district court Copenhagen finds guilty United Arab Emirates extradited Shah Denmark December negotiations included signing extradition treaty countries March 2022 prosecution statement Shah used welldesigned organised fraud scheme submit 3000 applications unlawfully receive nine billion kroner dividend tax refunds Treasury
10,https://edition.cnn.com/2022/08/02/europe/brittney-griner-trial-russia-tuesday/index.html,examination substance contained vape cartridges WNBA star Brittney Griners carried Moscow airport February comply Russian law defense expert testified Tuesday highstakes drugsmuggling trial Among violations results examination show amount THC substance Griners lawyer Maria Blagovolina hearing The examination comply law terms completeness study comply norms Code Criminal Procedure forensic chemist Dmitry Gladyshev testified defense roughly twohour session defense interrogated prosecution expert Alexander Korablyov examined Griners cartridges taken luggage
11,https://edition.cnn.com/2018/04/16/politics/pruitt-soundproof-booth/index.html,43000 purchase soundproof booth Environmental Protection Agency Administrator Scott Pruitts office violated federal law Government Accountability Office concluded Monday GAO government spending watchdog reports Congress cites requirement executive branch agencies must notify Congress spending 5000 certain office improvements Because EPA violated statutory requirement conclude EPA violated Antideficiency Act report violation Congress President required law GAO statement attorneys Julie Matta GAOs conclusions outlined letter congressional Democrats relate legality purchase whether booth appropriate use taxpayer dollars
12,https://news.postimees.ee/7416922/estonian-police-nab-boss-of-lithuanian-car-thieves,It secret Lithuanian car thieves nuisance Estonia decade recent conviction Aurimas Skirgaila regarded principal architects recent wave car theft Estonia Tartu County Court marks first time Lithuanian criminal convicted creating criminal organization Estonia South District Prosecutor Aro Siinmaa proceedings involving Lithuanian car thieves far There four rulings concerning group alone numerous persons ties criminal organization proved impossible bring Estonia various reasons Siinmaa This first time light shed success Estonian authorities leader group found guilty court
13,https://yle.fi/a/3-12659444,Helsinki District Court handed several lengthy prison sentences wideranging narcotics network case 23 defendants almost 70 charges Most verdicts given serious drug offences committed 2019 2021 different parts Helsinki metropolitan area A total 16 defendants received prison sentences three received suspended sentences According court drug ring trafficked considerable quantities illegal narcotics Finland Estimates police place street value drugs six million euros district court sentenced Teemu Juhani Kirves head Swedenbased drug syndicate  four prison several aggravated narcotics offences
14,https://icelandmonitor.mbl.is/news/news/2021/10/21/sentenced_to_16_years_in_prison/,This morning Angjelin Sterkaj sentenced 16 prison murder Armando Beqirai Albanian citizen 30s shot multiple times front home street Rauðagerði Reykjavík February 13 mblis reports case commonly referred Rauðagerði Case crime shook Icelandic society  characteristics execution typical Reykjavík neighborhood  criminologist described three people charged  men woman  acquitted prosecutions charges They charged accomplices crime sentence pronounced Reykjavík District Court Sterkaj present court room previously confessed killing Beqirai claiming selfdefense
15,https://www.ndtv.com/world-news/renault-nissan-alliance-carlos-ghosn-france-issues-international-arrest-warrant-against-ex-nissan-head-2909763,French authorities issued international arrest warrant Carlos Ghosn disgraced auto tycoon jumped bail Japan fled Lebanon sensational getaway prosecutors told AFP Friday warrant issued 15 million euros 163 million suspect payments RenaultNissan alliance Ghosn headed Omani company Suhail Bahwan Automobiles SBA prosecutors Paris suburb Nanterre Ghosn chief Nissan chief head alliance Renault Nissan Mitsubishi Motors detained Japan November 2018 suspicion financial misconduct along top aide Greg Kelly They denied wrongdoing
16,https://edition.cnn.com/2023/04/19/tech/china-seagate-huawei-penalty-hnk-intl/index.html,Seagate Technology agreed pay 300 million penalty settlement US authorities shipping 11 billion worth hard disk drives Chinas Huawei violation US export control laws Department Commerce Wednesday Seagate STX sold drives Huawei August 2020 September 2021 despite August 2020 rule restricted sales certain foreign items made US technology company Huawei placed Entity List US trade blacklist 2019 reduce sale US goods company amid national security foreign policy concerns penalty represents latest string actions Washington keep sophisticated technology China may support military enable human rights abuses otherwise threaten US security
17,https://www.channelnewsasia.com/asia/woman-plead-guilty-negligence-caring-2-babies-nurul-shahira-3504176,A Malaysian woman pleaded guilty Sunday May 21 negligence caring babies childcare centre Skudai Johor Nurul Shahira Ashiqin Sulaiman pleaded guilty Johor Bahru Sessions Court charges negligence may led physical injury 11month girl ninemonth boy Last week Johor police chief Kamarul Zaman Mamat told local media 28yearold Nurul Shahira Ashiqin arrested local cops Skudai He confirmed woman seen video clips treating infants inappropriately clips circulated widely WhatsApp Telegram
18,https://edition.cnn.com/2023/05/03/business/mcdonalds-child-labor-louisville/index.html,Two 10yearold children found working Louisville McDonalds restaurant  sometimes 2  US Department Labor Tuesday revelation part investigation child labor law violations Southeast agency found three franchisees 60 McDonalds locations Kentucky Indiana Maryland Ohio employed 305 children work legally permitted hours perform tasks prohibited law young workers Labor Department statement Investigators departments Wage Hour Division found 10yearold workers Louisville McDonalds restaurant among many violations federal labor laws committed three Kentucky McDonalds franchise operators release Investigators determined 10yearold children employed paid sometimes worked late 2 am
19,https://edition.cnn.com/2023/04/07/europe/russia-chinese-lgbtq-blogger-arrested-intl/index.html,Russian authorities arrested Chinese LGBTQ blogger Wednesday allegedly violating law bans socalled samesex propaganda according Adel Khaydarshin lawyer representing blogger partner Chinese national Haoyang Xu found guilty hearing Thursday Khaydarshin Hes held temporary detention center foreigners faces deportation Russia according statement court Khaydarshin gave CNN This comes months Russian President Vladimir Putin signed bill expanded existing ban socalled LGBTQ propaganda Russia It made illegal anyone promote samesex relationships suggest nonheterosexual orientations normal
20,https://edition.cnn.com/2021/07/30/tech/amazon-eu-privacy-fine/index.html,Amazon AMZN faces recordbreaking 746 million roughly 887 million fine European Union data privacy regulator ecommerce giant violated blocs signature privacy law known GDPR advertisingrelated decision fine imposed July 16 disclosed Friday financial filing It largest laws threeyear history followed Googles 2019 fine 50 million Regulators Amazons processing personal data didnt comply GDPR requirements company acknowledged ordered change business practices Amazon regulatory decision without merit added plans defend vigorously matter
21,https://edition.cnn.com/2024/03/07/europe/portugal-election-intl-cmd/index.html,party flirted extremism accused racism Ventura tried convicted making offensive racist remarks reference Black family Portugals poorest neighborhoods conviction Supreme Court upheld party denied accusations racism members many supporters openly flaunt hateful narratives social media Ventura wrote social media fellow MP holds dual PortugueseGuinean citizenship return country But likeminded movements Chega seems brushed criticism aside continued grow
22,https://edition.cnn.com/2010/WORLD/europe/10/20/czech.republic.arson.verdict/index.html,Four Czech neoNazis sentenced Wednesday long prison terms steep fines arson attack house Roma Gypsy family nearly killed 2yearold girl national news agency reported David Vaculik Ivo Mueller Jaromir Lukes Vaclav Cojocaru found guilty throwing Molotov cocktails house April 2009 attack mark Adolf Hitlers birthday Czech News Agency reported Vaculik Mueller Lukes sentenced 22 highsecurity prison Cojocaru got 20 They ordered pay 17 million Czech crowns 968000 medical treatment compensation All four men filed appeal immediately agency reported Ostrava Regional Court northeast Czech Republic found guilty attempted murder damage property
23,https://www.channelnewsasia.com/asia/tony-chung-exiled-activist-hong-kong-says-paid-informant-china-4016916,former leader Hong Kong proindependence group says received HK3000 security officers per meeting become informant released jail June fled Britain sought political asylum In November 2021 Tony Chung 20 sentenced 43 months prison trying separate city China money laundering Chung charged secession sweeping national security law imposed China 2020 denied bail He pleaded guilty He Thursday Dec 28 fled Britain freed formally applied political asylum
24,https://edition.cnn.com/2024/01/22/europe/ian-bailey-murder-dead-scli-intl/index.html,A British man long suspected killing wife famous French film producer Ireland died age 66 according lawyer Back 2019 Paris Criminal Court convicted Ian Bailey absentia murder TV producer Sophie Toscan du Plantier sentenced 25 years imprisonment Bailey former journalist denied involvement murder subject popular podcast series TV documentaries including Netflix On December 23 1996 39yearold Toscan du Plantier found bludgeoned death near gate vacation home near Toormore Irelands West Cork region Police found 50 wounds body
25,https://edition.cnn.com/2020/06/15/sport/daniel-kinahan-tyson-fury-anthony-joshua-boxing-ireland-spt-intl/index.html,In 2018 Irish High Court judgment delivered Byrne Organized Crime Group part wider international Kinahan Organized Crime Group court heard Kinahan Organized Crime Group involved importation distribution controlled drugs firearms Ireland UK mainland Europe operations drug trafficking managed controlled Daniel Kinahan law firm representing Kinahan respond CNNs question Irishman currently based though its widely reportedly hes living United Arab Emirates
26,https://www.channelnewsasia.com/singapore/red-crowns-senior-living-fined-offence-nursing-home-alternative-4233926,Red Crowns Senior Living fined Ministry Manpower MOM found company engaged illegal employment practices assisted coliving agency illegally hired deployed migrant domestic workers provide caregiving services allowing circumvent foreign manpower quota pay lower levy rates ministry told CNA Monday Apr 1 Red Crowns placed legal responsibilities elderly clients employed migrant domestic workers control work welfare MOM added company directors issued composition fines offences Employment Foreign Manpower Act ministry without mentioning exact amount fined
27,https://www.straitstimes.com/singapore/all-natural-eczema-cream-found-to-have-over-430-times-the-allowed-limit-of-arsenic-hsa,An eczema cream touted all natural steroidfree contains excessive levels arsenic potent steroid Health Sciences Authority HSA agency issued warning Nov 21 man 30s bought Euzema Confidence Revival Cream online used year suffered purpura purplish red spots due small bleeds skin mans doctor suspected skin reaction caused mineral containing arsenic reported case HSA On Malaysiabased retail website euzemacom cream able beat eczema good powerful natural formula steroidfree contains 100 allnatural herbs has side effects It sold ecommerce platform Carousell
28,https://edition.cnn.com/2022/12/06/politics/trump-organization-fraud-trial-verdict/index.html,A Manhattan jury found Trump Organization companies guilty multiple charges criminal tax fraud falsifying business records connected 15year scheme defraud tax authorities failing report pay taxes compensation top executives Trump Corp Trump Payroll Corp found guilty charges faced Donald Trump family charged case former president mentioned repeatedly trial prosecutors connection benefits doled certain executives including companyfunded apartments car leases personal expenses Trump Organization could face maximum 161 million fines sentenced midJanuary company risk dismantled mechanism New York law would dissolve company However felony conviction could impact ability business obtain loans contracts
29,https://www.straitstimes.com/singapore/courts-crime/company-director-gets-20-months-jail-152m-penalty-for-offences-related-to-iras-scheme,A director multiple companies sentenced 20 months jail ordered pay penalty 1520800 Tuesday offences committed relation scheme meant encourage businesses invest productivity innovation Sofian Osman 43 pleaded guilty nine charges committing fraud representing several companies incurred qualifying expenditure firms could obtain cash payouts Productivity Innovation Credit PIC Scheme offences committed 2014 2017 For charges cash payouts bonuses totalling 430600 given Inland Revenue Authority Iras various claimants result fraudulent claims Sofian another 16 similar charges taken consideration sentencing committed offences accomplice Muhammad Iskandar Abd Hakim sentenced July 2022
30,https://www.channelnewsasia.com/world/greta-thunberg-charged-again-disobeying-police-order-3773416,Swedish climate activist Greta Thunberg charged disobeying police order Friday Sep 15 less months convicted fined offence Thunberg 20 fined 1500 Swedish crowns US134 Swedish court Jul 24 failing leave protest ordered police Straight verdict Thunberg activists environmental group Reclaim Future blocked road oil trucks Malmo harbour forcibly removed police demonstration permit led blocking car traffic woman refused obey police command leave scene prosecutor statement
31,https://www.reuters.com/world/china/hong-kong-court-convicts-four-rioting-after-2019-legislature-storming-2024-02-01/,A Hong Kong court Thursday found four people guilty rioting legislature financial centre stormed prodemocracy protests 2019 verdict comes eight others already plead guilty charges incident hundreds protesters besieged Hong Kongs Legislative Council building July 1 2019 incursion seat government Chinese Special Administrative Region followed protest march proposed extradition bill would allowed authorities send individuals mainland China trial District Court Judge Li Chiho found four people including Ho Chunyin actor Gregory Wong Ng Chiyung Lam Kamkwan guilty rioting Ho suffers mild intellectual disability cried inside courtroom verdict read
32,https://edition.cnn.com/2020/01/19/us/alaska-dentist-hoverboard-convicted-trnd/index.html,A dentist Anchorage Alaska convicted dozens charges filmed extracting patients tooth stood hoverboard according Alaska Department Law Seth Lookhart convicted 46 felony misdemeanor counts Anchorage Superior Court Friday Judge Michael Wolverton called evidence presented state fiveweek bench trial overwhelming Department Law news release A lawsuit filed state 2017 charged Lookhart unlawful dental acts saying patient care meet professional standards Lookhart lawsuit performed dental extraction procedure sedated patient riding hoverboard filmed procedure sent several people
33,https://www.channelnewsasia.com/asia/vietnam-court-jails-soft-drinks-tycoon-40-miilion-scam-case-tan-hiep-phat-4291091,HO CHI MINH CITY Vietnams top soft drinks tycoon jailed eight Thursday Apr 25 US40 million fraud case latest highprofile business figure snared countrys sweeping crackdown corruption communist nations wideranging campaign wipe endemic graft seen 4400 people charged criminal offences including officials senior business figures A court Ho Chi Minh City found Tran Qui Thanh daughters guilty scamming investors loans issued 2019 2020 Thanh 71yearold chairman beverage group Tan Hiep Phat ruled masterminded scams appropriate assets put collateral loans state media reported
34,https://www.straitstimes.com/singapore/courts-crime/mfa-director-general-charged-over-use-of-diplomatic-bags-containing-panadol-luxury-watches,A directorgeneral Ministry Foreign Affairs MFA Gilbert Oh Hin Kwan Nov 23 charged deceiving MFA abetting cheating ministry giving false information public servant Oh 44yearold Singaporean faces three charges His name found MFAs website Oh allegedly dishonestly concealed MFA fact package containing boxes Panadol sent Beijing via diplomatic bag service personal acquaintance rather colleague Dion Loke Cheng Wang His charge stated MFA accepted package dispatch December 2022 basis Loke It would done known truth Loke listed first secretary political MFAs Beijing embassy
35,https://www.straitstimes.com/tech/tech-news/singapore-firms-fined-75000-for-personal-data-lapses-affecting-over-600000-people,Several companies fined total 75000 breaches lapses affected 600000 peoples personal data including names contact numbers cases financial information This included data 98000 Ministry Defence staff Armed Forces servicemen exposed breach 2019 due wellknown vulnerability knowingly left open four healthcare training provider HMI Institute Health Sciences HMI fined 35000 incident according judgment issued Personal Data Protection Commission PDPC last Thursday June 10 incident affected data 110000 people total including 250 HMI employees
36,https://www.reuters.com/business/finance/indias-paytm-payments-bank-fined-over-662000-money-laundering-2024-03-01/,Indias Financial Intelligence Unit FIU Friday imposed penalty 549 million rupees 662565 Paytms PAYTNS opens new tab banking arm Paytm Payments Bank violations reporting illegal money routed accounts countrys finance ministry FIU initiated review Paytm Payments Bank information law enforcement agencies entities engaged illegal acts including organising facilitating online gambling routing proceeds bank money generated illegal operations ie proceeds crime routed channelled bank accounts maintained entities Paytm Payments Bank ministry statement payments bank failed report suspicious transactions conduct due diligence accounts FIUs order Based voluminous material available record found charges Paytm Payments Bank substantiated ministry added
37,https://edition.cnn.com/2023/04/04/business/tiktok-uk-data-regulator-fine/index.html,UK data regulator fined TikTok £127 million 159 million number breaches data protection law including misusing childrens personal data Information Commissioners Office estimates 2020 TikTok allowed 1 million UK children 13 use platform violation rules ICO Tuesday TikTok done enough check using platform failed take action remove underage children hadnt provided proper information users data collected used fine applies rule breaches May 2018 July 2020
